{
  "contract_id": "active-champion",
  "schema_version": "1.0.0",
  "pointer_id": "active-champion/v1",
  "activation_id": "activation-0123456789abcdef0123",
  "champion_id": "champ-0123456789abcdef0123",
  "champion_sha256": "aaaaaaaaaaaaaaaaaaaaaaaaaaaaaaaaaaaaaaaaaaaaaaaaaaaaaaaaaaaaaaaa",
  "receipt_sha256": "bbbbbbbbbbbbbbbbbbbbbbbbbbbbbbbbbbbbbbbbbbbbbbbbbbbbbbbbbbbbbbbb",
  "approval_id": "manual-approval-20260818",
  "activated_at": "2026-08-18T12:00:00Z",
  "previous_champion_id": null,
  "promotion_id": "promo-0123456789abcdef"
}
